{
  "$schema": "https://json-schema.org/draft/2020-12/schema",
  "$id": "https://roamory.app/contracts/timeline.schema.json",
  "title": "Timeline",
  "description": "Golden timeline for one example edit spec: where each clip lands in the finished video (README, Duration). Generated from the iOS EditTimeline; both renderers test against it so Review's moment times match either engine.",
  "type": "object",
  "additionalProperties": false,
  "required": ["edit_spec", "slots", "end_card_start_s", "total_s"],
  "properties": {
    "edit_spec": {
      "type": "string",
      "pattern": "^edit_spec_[a-z]+\\.json$",
      "description": "The example in this folder it was computed from."
    },
    "slots": {
      "type": "array",
      "minItems": 1,
      "description": "In playback order, one per edit spec clip. Output seconds, rounded to 1 ms.",
      "items": {
        "type": "object",
        "additionalProperties": false,
        "required": ["moment_id", "start_s", "end_s"],
        "properties": {
          "moment_id": {"type": "string", "minLength": 1},
          "start_s": {"type": "number", "minimum": 0},
          "end_s": {"type": "number", "exclusiveMinimum": 0}
        }
      }
    },
    "end_card_start_s": {"type": "number", "exclusiveMinimum": 0},
    "total_s": {"type": "number", "exclusiveMinimum": 0}
  }
}
