{
  "edit_spec": "edit_spec_vlog.json",
  "slots": [
    {
      "moment_id": "m_01",
      "start_s": 0,
      "end_s": 5
    },
    {
      "moment_id": "m_02",
      "start_s": 5,
      "end_s": 10
    },
    {
      "moment_id": "m_03",
      "start_s": 10,
      "end_s": 16
    },
    {
      "moment_id": "m_04",
      "start_s": 16,
      "end_s": 20
    },
    {
      "moment_id": "m_06",
      "start_s": 20,
      "end_s": 25
    },
    {
      "moment_id": "m_08",
      "start_s": 25,
      "end_s": 30
    },
    {
      "moment_id": "m_09",
      "start_s": 30,
      "end_s": 34
    },
    {
      "moment_id": "m_10",
      "start_s": 34,
      "end_s": 39
    },
    {
      "moment_id": "m_11",
      "start_s": 39,
      "end_s": 43
    },
    {
      "moment_id": "m_12",
      "start_s": 43,
      "end_s": 48
    }
  ],
  "end_card_start_s": 48,
  "total_s": 50
}
